zodiac,type,fortune,contact_time,contact_reason
사자자리,행동운,오늘 사람들 앞에서 자신을 표현하는 것이 강점으로 작용합니다.,오전 11시~오후 1시,사자자리는 하루가 달아오른 오전 후반이 에너지가 가장 높습니다. 이 시간에 나누는 연락이 인상에 남습니다.
사자자리,행동운,행동 전에 한 번만 더 생각하는 것이 오늘 더 좋은 결과를 만들습니다.,오전 11시~오후 1시,사자자리는 하루가 달아오른 오전 후반이 에너지가 가장 높습니다. 이 시간에 나누는 연락이 인상에 남습니다.
사자자리,행동운,오늘 창의성을 행동으로 연결하는 날입니다.,오전 11시~오후 1시,사자자리는 하루가 달아오른 오전 후반이 에너지가 가장 높습니다. 이 시간에 나누는 연락이 인상에 남습니다.
사자자리,행동운,사자자리답게 당당하게 움직이는 날입니다.,오전 11시~오후 1시,사자자리는 하루가 달아오른 오전 후반이 에너지가 가장 높습니다. 이 시간에 나누는 연락이 인상에 남습니다.
처녀자리,총운,오늘 완벽하지 않아도 괜찮습니다. 80%에서 내보내는 연습을 오늘 해보시기 바랍니다. 나머지 20%는 다음 버전에서 합니다.,오전 9시~11시,처녀자리는 오전에 머리가 가장 잘 돌아갑니다. 중요한 연락은 이 시간에 보내는 게 가장 정확하게 전달됩니다.
처녀자리,총운,꼼꼼함이 빛나는 날입니다. 남들이 놓친 것을 처녀자리가 잡아내는 날입니다.,오전 9시~11시,처녀자리는 오전에 머리가 가장 잘 돌아갑니다. 중요한 연락은 이 시간에 보내는 게 가장 정확하게 전달됩니다.
처녀자리,총운,오늘 분석력이 특히 날카로운 날입니다. 중요한 결정을 내리기 좋습니다.,오전 9시~11시,처녀자리는 오전에 머리가 가장 잘 돌아갑니다. 중요한 연락은 이 시간에 보내는 게 가장 정확하게 전달됩니다.
처녀자리,총운,과도한 자기비판을 하는 날입니다. 오늘 자신에게 조금 더 너그러워보시기 바랍니다.,오전 9시~11시,처녀자리는 오전에 머리가 가장 잘 돌아갑니다. 중요한 연락은 이 시간에 보내는 게 가장 정확하게 전달됩니다.
처녀자리,총운,세부사항에 집중하다 전체 그림을 놓칠 수 있습니다. 오늘 가끔 한 발 물러서 보시기 바랍니다.,오전 9시~11시,처녀자리는 오전에 머리가 가장 잘 돌아갑니다. 중요한 연락은 이 시간에 보내는 게 가장 정확하게 전달됩니다.
처녀자리,총운,정리 정돈이 마음을 편하게 만드는 날입니다. 공간을 정리하면 생각도 정리됩니다.,오전 9시~11시,처녀자리는 오전에 머리가 가장 잘 돌아갑니다. 중요한 연락은 이 시간에 보내는 게 가장 정확하게 전달됩니다.
처녀자리,총운,오늘 꾸준히 해온 것들이 결실을 맺는 날입니다.,오전 9시~11시,처녀자리는 오전에 머리가 가장 잘 돌아갑니다. 중요한 연락은 이 시간에 보내는 게 가장 정확하게 전달됩니다.
처녀자리,총운,계획대로 잘 흘러가는 날입니다. 처녀자리의 준비성이 빛을 발합니다.,오전 9시~11시,처녀자리는 오전에 머리가 가장 잘 돌아갑니다. 중요한 연락은 이 시간에 보내는 게 가장 정확하게 전달됩니다.
처녀자리,총운,오늘 비판적 시각을 잠깐 내려놓고 있는 그대로 받아들여보시기 바랍니다.,오전 9시~11시,처녀자리는 오전에 머리가 가장 잘 돌아갑니다. 중요한 연락은 이 시간에 보내는 게 가장 정확하게 전달됩니다.
처녀자리,총운,성실함이 인정받는 날입니다.,오전 9시~11시,처녀자리는 오전에 머리가 가장 잘 돌아갑니다. 중요한 연락은 이 시간에 보내는 게 가장 정확하게 전달됩니다.
처녀자리,총운,오늘 작은 것에서 큰 만족을 찾는 날입니다.,오전 9시~11시,처녀자리는 오전에 머리가 가장 잘 돌아갑니다. 중요한 연락은 이 시간에 보내는 게 가장 정확하게 전달됩니다.
처녀자리,총운,세부사항을 챙기는 능력이 오늘 중요한 차이를 만들습니다.,오전 9시~11시,처녀자리는 오전에 머리가 가장 잘 돌아갑니다. 중요한 연락은 이 시간에 보내는 게 가장 정확하게 전달됩니다.
처녀자리,총운,오늘 자신의 능력을 과소평가하지 마시기 바랍니다. 처녀자리는 생각보다 훨씬 잘 해내고 있습니다.,오전 9시~11시,처녀자리는 오전에 머리가 가장 잘 돌아갑니다. 중요한 연락은 이 시간에 보내는 게 가장 정확하게 전달됩니다.
처녀자리,총운,루틴이 안정감을 주는 날입니다. 익숙한 것들로 하루를 채워보시기 바랍니다.,오전 9시~11시,처녀자리는 오전에 머리가 가장 잘 돌아갑니다. 중요한 연락은 이 시간에 보내는 게 가장 정확하게 전달됩니다.
처녀자리,총운,오늘 분석에 너무 오래 머물지 말고 실행으로 넘어가는 날입니다.,오전 9시~11시,처녀자리는 오전에 머리가 가장 잘 돌아갑니다. 중요한 연락은 이 시간에 보내는 게 가장 정확하게 전달됩니다.
처녀자리,총운,완벽한 계획보다 지금 시작하는 것이 오늘 더 맞습니다.,오전 9시~11시,처녀자리는 오전에 머리가 가장 잘 돌아갑니다. 중요한 연락은 이 시간에 보내는 게 가장 정확하게 전달됩니다.
처녀자리,총운,오늘 자신에게 잘했다는 말을 해주시기 바랍니다.,오전 9시~11시,처녀자리는 오전에 머리가 가장 잘 돌아갑니다. 중요한 연락은 이 시간에 보내는 게 가장 정확하게 전달됩니다.
처녀자리,총운,처녀자리의 관찰력이 오늘 중요한 것을 발견하는 날입니다.,오전 9시~11시,처녀자리는 오전에 머리가 가장 잘 돌아갑니다. 중요한 연락은 이 시간에 보내는 게 가장 정확하게 전달됩니다.
처녀자리,총운,오늘 세심함이 주변 사람들에게 감사받는 날입니다.,오전 9시~11시,처녀자리는 오전에 머리가 가장 잘 돌아갑니다. 중요한 연락은 이 시간에 보내는 게 가장 정확하게 전달됩니다.
처녀자리,총운,스스로를 믿는 것이 오늘 가장 강한 도구입니다.,오전 9시~11시,처녀자리는 오전에 머리가 가장 잘 돌아갑니다. 중요한 연락은 이 시간에 보내는 게 가장 정확하게 전달됩니다.
처녀자리,애정운,말보다 행동으로 마음을 전하는 날입니다. 처녀자리답게 세심한 배려를 보여주시기 바랍니다.,오전 9시~11시,처녀자리는 오전에 머리가 가장 잘 돌아갑니다. 중요한 연락은 이 시간에 보내는 게 가장 정확하게 전달됩니다.
처녀자리,애정운,오늘 상대방의 작은 것도 챙겨주는 것이 사랑의 표현입니다.,오전 9시~11시,처녀자리는 오전에 머리가 가장 잘 돌아갑니다. 중요한 연락은 이 시간에 보내는 게 가장 정확하게 전달됩니다.
처녀자리,애정운,완벽한 타이밍을 기다리지 말고 오늘 그냥 표현해보시기 바랍니다.,오전 9시~11시,처녀자리는 오전에 머리가 가장 잘 돌아갑니다. 중요한 연락은 이 시간에 보내는 게 가장 정확하게 전달됩니다.
처녀자리,애정운,상대방의 단점이 눈에 들어오는 날입니다. 그 시각을 잠깐 내려놓아보시기 바랍니다.,오전 9시~11시,처녀자리는 오전에 머리가 가장 잘 돌아갑니다. 중요한 연락은 이 시간에 보내는 게 가장 정확하게 전달됩니다.
처녀자리,애정운,오늘 솔직한 대화가 관계를 더 건강하게 만드는 날입니다.,오전 9시~11시,처녀자리는 오전에 머리가 가장 잘 돌아갑니다. 중요한 연락은 이 시간에 보내는 게 가장 정확하게 전달됩니다.
처녀자리,애정운,처녀자리는 천천히 마음을 열지만 한번 열면 깊습니다. 오늘 그 깊이를 보여줘도 됩니다.,오전 9시~11시,처녀자리는 오전에 머리가 가장 잘 돌아갑니다. 중요한 연락은 이 시간에 보내는 게 가장 정확하게 전달됩니다.
처녀자리,애정운,관계에서 과도하게 분석하지 않아도 되는 날입니다. 그냥 느껴보시기 바랍니다.,오전 9시~11시,처녀자리는 오전에 머리가 가장 잘 돌아갑니다. 중요한 연락은 이 시간에 보내는 게 가장 정확하게 전달됩니다.
처녀자리,애정운,오늘 상대방을 있는 그대로 받아들이는 연습을 해보시기 바랍니다.,오전 9시~11시,처녀자리는 오전에 머리가 가장 잘 돌아갑니다. 중요한 연락은 이 시간에 보내는 게 가장 정확하게 전달됩니다.
처녀자리,애정운,누군가를 위해 뭔가를 정성스럽게 준비하는 날입니다.,오전 9시~11시,처녀자리는 오전에 머리가 가장 잘 돌아갑니다. 중요한 연락은 이 시간에 보내는 게 가장 정확하게 전달됩니다.
처녀자리,애정운,오늘 먼저 다가가는 것이 의외로 잘 받아들여지는 날입니다.,오전 9시~11시,처녀자리는 오전에 머리가 가장 잘 돌아갑니다. 중요한 연락은 이 시간에 보내는 게 가장 정확하게 전달됩니다.
처녀자리,애정운,관계에서 너무 많이 챙기다 자신이 지치는 패턴을 오늘 의식해보시기 바랍니다.,오전 9시~11시,처녀자리는 오전에 머리가 가장 잘 돌아갑니다. 중요한 연락은 이 시간에 보내는 게 가장 정확하게 전달됩니다.
처녀자리,애정운,오늘 상대방의 노력을 알아봐주는 것이 큰 의미가 됩니다.,오전 9시~11시,처녀자리는 오전에 머리가 가장 잘 돌아갑니다. 중요한 연락은 이 시간에 보내는 게 가장 정확하게 전달됩니다.
처녀자리,애정운,처녀자리의 세심함이 오늘 관계에서 빛나는 날입니다.,오전 9시~11시,처녀자리는 오전에 머리가 가장 잘 돌아갑니다. 중요한 연락은 이 시간에 보내는 게 가장 정확하게 전달됩니다.
처녀자리,애정운,오늘 감사함을 표현하는 것이 관계를 따뜻하게 합니다.,오전 9시~11시,처녀자리는 오전에 머리가 가장 잘 돌아갑니다. 중요한 연락은 이 시간에 보내는 게 가장 정확하게 전달됩니다.
처녀자리,애정운,완벽한 사랑보다 진심 어린 사랑이 오늘 더 강합니다.,오전 9시~11시,처녀자리는 오전에 머리가 가장 잘 돌아갑니다. 중요한 연락은 이 시간에 보내는 게 가장 정확하게 전달됩니다.
처녀자리,애정운,오늘 자신을 사랑하는 것이 더 좋은 관계를 만드는 날입니다.,오전 9시~11시,처녀자리는 오전에 머리가 가장 잘 돌아갑니다. 중요한 연락은 이 시간에 보내는 게 가장 정확하게 전달됩니다.
처녀자리,애정운,관계에서 조급함을 내려놓는 날입니다.,오전 9시~11시,처녀자리는 오전에 머리가 가장 잘 돌아갑니다. 중요한 연락은 이 시간에 보내는 게 가장 정확하게 전달됩니다.
처녀자리,애정운,오늘 편지나 문자로 마음을 전하는 것이 잘 닿는 날입니다.,오전 9시~11시,처녀자리는 오전에 머리가 가장 잘 돌아갑니다. 중요한 연락은 이 시간에 보내는 게 가장 정확하게 전달됩니다.
처녀자리,애정운,상대방의 건강이나 컨디션을 챙겨주는 것이 처녀자리다운 사랑입니다.,오전 9시~11시,처녀자리는 오전에 머리가 가장 잘 돌아갑니다. 중요한 연락은 이 시간에 보내는 게 가장 정확하게 전달됩니다.
처녀자리,애정운,오늘 가까운 사람에게 솔직한 조언을 해주는 것이 사랑입니다.,오전 9시~11시,처녀자리는 오전에 머리가 가장 잘 돌아갑니다. 중요한 연락은 이 시간에 보내는 게 가장 정확하게 전달됩니다.
처녀자리,금전운,계획적인 소비가 빛나는 날입니다. 처녀자리의 꼼꼼한 금전 관리가 오늘 결실을 맺습니다.,오전 9시~11시,처녀자리는 오전에 머리가 가장 잘 돌아갑니다. 중요한 연락은 이 시간에 보내는 게 가장 정확하게 전달됩니다.
처녀자리,금전운,오늘 예산을 다시 점검하기 좋은 날입니다.,오전 9시~11시,처녀자리는 오전에 머리가 가장 잘 돌아갑니다. 중요한 연락은 이 시간에 보내는 게 가장 정확하게 전달됩니다.
처녀자리,금전운,작은 절약이 모이는 날입니다. 처녀자리의 알뜰함이 오늘 특히 발휘됩니다.,오전 9시~11시,처녀자리는 오전에 머리가 가장 잘 돌아갑니다. 중요한 연락은 이 시간에 보내는 게 가장 정확하게 전달됩니다.
처녀자리,금전운,오늘 충동구매가 거의 없는 날입니다. 처녀자리는 분석 후 소비하는 타입입니다.,오전 9시~11시,처녀자리는 오전에 머리가 가장 잘 돌아갑니다. 중요한 연락은 이 시간에 보내는 게 가장 정확하게 전달됩니다.
처녀자리,금전운,가계부나 예산 계획표를 세우기 좋은 날입니다.,오전 9시~11시,처녀자리는 오전에 머리가 가장 잘 돌아갑니다. 중요한 연락은 이 시간에 보내는 게 가장 정확하게 전달됩니다.
처녀자리,금전운,오늘 투자 관련 정보를 꼼꼼하게 검토하기 좋은 날입니다.,오전 9시~11시,처녀자리는 오전에 머리가 가장 잘 돌아갑니다. 중요한 연락은 이 시간에 보내는 게 가장 정확하게 전달됩니다.
처녀자리,금전운,예상치 못한 수입이 생기는 날입니다.,오전 9시~11시,처녀자리는 오전에 머리가 가장 잘 돌아갑니다. 중요한 연락은 이 시간에 보내는 게 가장 정확하게 전달됩니다.
처녀자리,금전운,금전 관련 서류를 정리하거나 확인하기 좋은 날입니다.,오전 9시~11시,처녀자리는 오전에 머리가 가장 잘 돌아갑니다. 중요한 연락은 이 시간에 보내는 게 가장 정확하게 전달됩니다.
처녀자리,금전운,오늘 가치 있는 것에 투자하는 것이 맞는 날입니다.,오전 9시~11시,처녀자리는 오전에 머리가 가장 잘 돌아갑니다. 중요한 연락은 이 시간에 보내는 게 가장 정확하게 전달됩니다.
처녀자리,금전운,소소한 지출이 생기지만 필요한 것들입니다.,오전 9시~11시,처녀자리는 오전에 머리가 가장 잘 돌아갑니다. 중요한 연락은 이 시간에 보내는 게 가장 정확하게 전달됩니다.
처녀자리,금전운,오늘 재정 목표를 다시 설정하기 좋은 날입니다.,오전 9시~11시,처녀자리는 오전에 머리가 가장 잘 돌아갑니다. 중요한 연락은 이 시간에 보내는 게 가장 정확하게 전달됩니다.
처녀자리,금전운,처녀자리의 분석력이 금전 결정에서 빛나는 날입니다.,오전 9시~11시,처녀자리는 오전에 머리가 가장 잘 돌아갑니다. 중요한 연락은 이 시간에 보내는 게 가장 정확하게 전달됩니다.
처녀자리,금전운,오늘 작은 것들이 쌓여서 큰 수입이 되는 흐름이 보이는 날입니다.,오전 9시~11시,처녀자리는 오전에 머리가 가장 잘 돌아갑니다. 중요한 연락은 이 시간에 보내는 게 가장 정확하게 전달됩니다.
처녀자리,금전운,금전 걱정을 숫자로 정리하면 훨씬 명확해지는 날입니다.,오전 9시~11시,처녀자리는 오전에 머리가 가장 잘 돌아갑니다. 중요한 연락은 이 시간에 보내는 게 가장 정확하게 전달됩니다.
처녀자리,금전운,오늘 절약보다 효율적인 지출에 집중하는 날입니다.,오전 9시~11시,처녀자리는 오전에 머리가 가장 잘 돌아갑니다. 중요한 연락은 이 시간에 보내는 게 가장 정확하게 전달됩니다.
처녀자리,금전운,오래된 구독이나 자동결제를 정리하기 정확히 좋은 날입니다.,오전 9시~11시,처녀자리는 오전에 머리가 가장 잘 돌아갑니다. 중요한 연락은 이 시간에 보내는 게 가장 정확하게 전달됩니다.
처녀자리,금전운,처녀자리의 꼼꼼함이 금전 실수를 예방하는 날입니다.,오전 9시~11시,처녀자리는 오전에 머리가 가장 잘 돌아갑니다. 중요한 연락은 이 시간에 보내는 게 가장 정확하게 전달됩니다.
처녀자리,금전운,오늘 건강 관련 지출은 아깝지 않은 투자입니다.,오전 9시~11시,처녀자리는 오전에 머리가 가장 잘 돌아갑니다. 중요한 연락은 이 시간에 보내는 게 가장 정확하게 전달됩니다.
처녀자리,금전운,장기 저축 계획을 세우기 좋은 날입니다.,오전 9시~11시,처녀자리는 오전에 머리가 가장 잘 돌아갑니다. 중요한 연락은 이 시간에 보내는 게 가장 정확하게 전달됩니다.
처녀자리,금전운,금전보다 시간 관리가 오늘 더 중요한 날입니다.,오전 9시~11시,처녀자리는 오전에 머리가 가장 잘 돌아갑니다. 중요한 연락은 이 시간에 보내는 게 가장 정확하게 전달됩니다.
처녀자리,직장운,오늘 꼼꼼함이 인정받는 날입니다. 처녀자리가 발견한 오류가 큰 문제를 막습니다.,오전 9시~11시,처녀자리는 오전에 머리가 가장 잘 돌아갑니다. 중요한 연락은 이 시간에 보내는 게 가장 정확하게 전달됩니다.
처녀자리,직장운,완벽하게 준비된 후에 시작하고 싶지만 오늘은 80%에서 시작해도 충분합니다.,오전 9시~11시,처녀자리는 오전에 머리가 가장 잘 돌아갑니다. 중요한 연락은 이 시간에 보내는 게 가장 정확하게 전달됩니다.
처녀자리,직장운,세부사항을 챙기는 업무에서 탁월한 결과를 내는 날입니다.,오전 9시~11시,처녀자리는 오전에 머리가 가장 잘 돌아갑니다. 중요한 연락은 이 시간에 보내는 게 가장 정확하게 전달됩니다.
처녀자리,직장운,오늘 분석이 필요한 과제에서 처녀자리가 독보적인 날입니다.,오전 9시~11시,처녀자리는 오전에 머리가 가장 잘 돌아갑니다. 중요한 연락은 이 시간에 보내는 게 가장 정확하게 전달됩니다.
처녀자리,직장운,자기비판이 강한 날입니다. 오늘은 자신이 한 것에 집중하고 못 한 것은 내일 합니다.,오전 9시~11시,처녀자리는 오전에 머리가 가장 잘 돌아갑니다. 중요한 연락은 이 시간에 보내는 게 가장 정확하게 전달됩니다.
처녀자리,직장운,오늘 팀 내에서 신뢰받는 역할을 맡게 되는 날입니다.,오전 9시~11시,처녀자리는 오전에 머리가 가장 잘 돌아갑니다. 중요한 연락은 이 시간에 보내는 게 가장 정확하게 전달됩니다.
처녀자리,직장운,업무 마감이 잘 지켜지는 날입니다. 처녀자리의 계획성이 빛습니다.,오전 9시~11시,처녀자리는 오전에 머리가 가장 잘 돌아갑니다. 중요한 연락은 이 시간에 보내는 게 가장 정확하게 전달됩니다.
처녀자리,직장운,오늘 개선할 점을 발견하는 날입니다. 그 개선이 전체를 더 좋게 만들습니다.,오전 9시~11시,처녀자리는 오전에 머리가 가장 잘 돌아갑니다. 중요한 연락은 이 시간에 보내는 게 가장 정확하게 전달됩니다.
처녀자리,직장운,새로운 방식보다 검증된 방식이 오늘 더 좋은 결과를 내요.,오전 9시~11시,처녀자리는 오전에 머리가 가장 잘 돌아갑니다. 중요한 연락은 이 시간에 보내는 게 가장 정확하게 전달됩니다.
처녀자리,직장운,오늘 혼자 집중해서 일할 때 최고의 결과가 나오는 날입니다.,오전 9시~11시,처녀자리는 오전에 머리가 가장 잘 돌아갑니다. 중요한 연락은 이 시간에 보내는 게 가장 정확하게 전달됩니다.
처녀자리,직장운,상사나 클라이언트의 피드백을 개선 기회로 받아들이는 날입니다.,오전 9시~11시,처녀자리는 오전에 머리가 가장 잘 돌아갑니다. 중요한 연락은 이 시간에 보내는 게 가장 정확하게 전달됩니다.
처녀자리,직장운,처녀자리의 성실함이 오늘 주변에 영향을 미치는 날입니다.,오전 9시~11시,처녀자리는 오전에 머리가 가장 잘 돌아갑니다. 중요한 연락은 이 시간에 보내는 게 가장 정확하게 전달됩니다.
처녀자리,직장운,오늘 업무에서 실수가 적은 날입니다. 처녀자리의 꼼꼼함 덕분입니다.,오전 9시~11시,처녀자리는 오전에 머리가 가장 잘 돌아갑니다. 중요한 연락은 이 시간에 보내는 게 가장 정확하게 전달됩니다.
처녀자리,직장운,새로운 기술이나 방법을 익히기 좋은 날입니다.,오전 9시~11시,처녀자리는 오전에 머리가 가장 잘 돌아갑니다. 중요한 연락은 이 시간에 보내는 게 가장 정확하게 전달됩니다.
처녀자리,직장운,오늘 업무 효율을 높이는 아이디어가 떠오르는 날입니다.,오전 9시~11시,처녀자리는 오전에 머리가 가장 잘 돌아갑니다. 중요한 연락은 이 시간에 보내는 게 가장 정확하게 전달됩니다.
처녀자리,직장운,완벽주의가 오늘 발목을 잡을 수 있습니다. 충분히 좋은 것으로 진행합니다.,오전 9시~11시,처녀자리는 오전에 머리가 가장 잘 돌아갑니다. 중요한 연락은 이 시간에 보내는 게 가장 정확하게 전달됩니다.
처녀자리,직장운,오늘 문서 작업이나 정리가 필요한 업무에서 탁월한 날입니다.,오전 9시~11시,처녀자리는 오전에 머리가 가장 잘 돌아갑니다. 중요한 연락은 이 시간에 보내는 게 가장 정확하게 전달됩니다.
처녀자리,직장운,세심한 배려가 팀워크를 높이는 날입니다.,오전 9시~11시,처녀자리는 오전에 머리가 가장 잘 돌아갑니다. 중요한 연락은 이 시간에 보내는 게 가장 정확하게 전달됩니다.
처녀자리,직장운,오늘 업무에서 중요한 디테일을 잡아내는 날입니다.,오전 9시~11시,처녀자리는 오전에 머리가 가장 잘 돌아갑니다. 중요한 연락은 이 시간에 보내는 게 가장 정확하게 전달됩니다.
처녀자리,직장운,처녀자리의 분석력이 복잡한 문제를 해결하는 날입니다.,오전 9시~11시,처녀자리는 오전에 머리가 가장 잘 돌아갑니다. 중요한 연락은 이 시간에 보내는 게 가장 정확하게 전달됩니다.
처녀자리,건강운,스트레스가 소화기에 가는 날입니다. 따뜻한 음식과 충분한 물이 도움이 됩니다.,오전 9시~11시,처녀자리는 오전에 머리가 가장 잘 돌아갑니다. 중요한 연락은 이 시간에 보내는 게 가장 정확하게 전달됩니다.
처녀자리,건강운,규칙적인 루틴이 가장 중요한 날입니다. 처녀자리는 루틴에서 건강을 찾는 타입입니다.,오전 9시~11시,처녀자리는 오전에 머리가 가장 잘 돌아갑니다. 중요한 연락은 이 시간에 보내는 게 가장 정확하게 전달됩니다.
처녀자리,건강운,오늘 과도한 자기비판이 건강에 영향을 주는 날입니다. 자신에게 너그러워보시기 바랍니다.,오전 9시~11시,처녀자리는 오전에 머리가 가장 잘 돌아갑니다. 중요한 연락은 이 시간에 보내는 게 가장 정확하게 전달됩니다.
처녀자리,건강운,소화기 건강에 좋은 음식을 먹는 날입니다. 자극적인 음식을 피하시기 바랍니다.,오전 9시~11시,처녀자리는 오전에 머리가 가장 잘 돌아갑니다. 중요한 연락은 이 시간에 보내는 게 가장 정확하게 전달됩니다.
처녀자리,건강운,오늘 충분한 수면이 가장 중요한 건강 관리입니다.,오전 9시~11시,처녀자리는 오전에 머리가 가장 잘 돌아갑니다. 중요한 연락은 이 시간에 보내는 게 가장 정확하게 전달됩니다.
처녀자리,건강운,복부 스트레칭이나 요가가 오늘 특히 도움이 되는 날입니다.,오전 9시~11시,처녀자리는 오전에 머리가 가장 잘 돌아갑니다. 중요한 연락은 이 시간에 보내는 게 가장 정확하게 전달됩니다.
처녀자리,건강운,건강 관련 정보를 꼼꼼하게 확인하는 날입니다. 처녀자리의 분석력이 건강에서도 쓰여요.,오전 9시~11시,처녀자리는 오전에 머리가 가장 잘 돌아갑니다. 중요한 연락은 이 시간에 보내는 게 가장 정확하게 전달됩니다.
처녀자리,건강운,오늘 규칙적인 식사가 에너지를 유지하는 핵심입니다.,오전 9시~11시,처녀자리는 오전에 머리가 가장 잘 돌아갑니다. 중요한 연락은 이 시간에 보내는 게 가장 정확하게 전달됩니다.
처녀자리,건강운,완벽한 건강 루틴보다 지금 할 수 있는 것부터 하는 날입니다.,오전 9시~11시,처녀자리는 오전에 머리가 가장 잘 돌아갑니다. 중요한 연락은 이 시간에 보내는 게 가장 정확하게 전달됩니다.
처녀자리,건강운,오늘 소소한 증상도 무시하지 말고 확인하는 날입니다.,오전 9시~11시,처녀자리는 오전에 머리가 가장 잘 돌아갑니다. 중요한 연락은 이 시간에 보내는 게 가장 정확하게 전달됩니다.
