zodiac,type,fortune,contact_time,contact_reason
쌍둥이자리,금전운,"정보를 빠르게 모으는 오늘, 금전 관련 유용한 정보도 들어올 수 있습니다. 바로 실행은 말고 검토해보시기 바랍니다.",오전 10시~12시,쌍둥이자리는 오전 중반이 말이 잘 나오는 시간입니다. 이 시간대 연락이 가장 자연스럽게 이어집니다.
쌍둥이자리,금전운,오늘 충동구매보다 비교 구매가 맞는 날입니다. 쌍둥이자리는 정보를 잘 모으니 더 좋은 선택을 할 수 있습니다.,오전 10시~12시,쌍둥이자리는 오전 중반이 말이 잘 나오는 시간입니다. 이 시간대 연락이 가장 자연스럽게 이어집니다.
쌍둥이자리,금전운,새로운 수입 아이디어가 떠오르는 날입니다. 글이나 말로 돈을 버는 방향이 쌍둥이자리에게 잘 맞습니다.,오전 10시~12시,쌍둥이자리는 오전 중반이 말이 잘 나오는 시간입니다. 이 시간대 연락이 가장 자연스럽게 이어집니다.
쌍둥이자리,금전운,오늘 금전 계획을 세우기 좋은 날입니다. 두 가지 방안을 놓고 비교해보시기 바랍니다.,오전 10시~12시,쌍둥이자리는 오전 중반이 말이 잘 나오는 시간입니다. 이 시간대 연락이 가장 자연스럽게 이어집니다.
쌍둥이자리,금전운,지출이 다양한 방향으로 흩어지는 날입니다. 오늘은 한 카테고리에서만 써보는 연습을 해보시기 바랍니다.,오전 10시~12시,쌍둥이자리는 오전 중반이 말이 잘 나오는 시간입니다. 이 시간대 연락이 가장 자연스럽게 이어집니다.
쌍둥이자리,금전운,오늘 투자 정보를 접할 수 있습니다. 쌍둥이자리는 분석은 빠른데 결정이 늦을 수 있습니다. 기한을 정해서 결정해보시기 바랍니다.,오전 10시~12시,쌍둥이자리는 오전 중반이 말이 잘 나오는 시간입니다. 이 시간대 연락이 가장 자연스럽게 이어집니다.
쌍둥이자리,금전운,예상치 못한 작은 수입이 생기는 날입니다.,오전 10시~12시,쌍둥이자리는 오전 중반이 말이 잘 나오는 시간입니다. 이 시간대 연락이 가장 자연스럽게 이어집니다.
쌍둥이자리,금전운,오늘 금전 관련 서류나 계약을 꼼꼼히 확인하는 날입니다.,오전 10시~12시,쌍둥이자리는 오전 중반이 말이 잘 나오는 시간입니다. 이 시간대 연락이 가장 자연스럽게 이어집니다.
쌍둥이자리,금전운,여러 가지 금전 방안을 동시에 고려하고 있다면 오늘 하나로 좁혀보시기 바랍니다.,오전 10시~12시,쌍둥이자리는 오전 중반이 말이 잘 나오는 시간입니다. 이 시간대 연락이 가장 자연스럽게 이어집니다.
쌍둥이자리,금전운,오늘 쓰는 것보다 버는 것에 더 집중하기 좋은 날입니다.,오전 10시~12시,쌍둥이자리는 오전 중반이 말이 잘 나오는 시간입니다. 이 시간대 연락이 가장 자연스럽게 이어집니다.
쌍둥이자리,금전운,소소하지만 현명한 소비를 하는 날입니다. 쌍둥이자리의 정보력이 좋은 선택을 만들습니다.,오전 10시~12시,쌍둥이자리는 오전 중반이 말이 잘 나오는 시간입니다. 이 시간대 연락이 가장 자연스럽게 이어집니다.
쌍둥이자리,금전운,오늘 누군가와 금전 관련 아이디어를 나눠보시기 바랍니다. 쌍둥이자리는 대화에서 좋은 아이디어가 나오는 타입입니다.,오전 10시~12시,쌍둥이자리는 오전 중반이 말이 잘 나오는 시간입니다. 이 시간대 연락이 가장 자연스럽게 이어집니다.
쌍둥이자리,금전운,오래된 구독이나 자동결제를 정리하기 좋은 날입니다.,오전 10시~12시,쌍둥이자리는 오전 중반이 말이 잘 나오는 시간입니다. 이 시간대 연락이 가장 자연스럽게 이어집니다.
쌍둥이자리,금전운,오늘 금전보다 시간을 어떻게 쓸지가 더 중요한 날입니다.,오전 10시~12시,쌍둥이자리는 오전 중반이 말이 잘 나오는 시간입니다. 이 시간대 연락이 가장 자연스럽게 이어집니다.
쌍둥이자리,금전운,새로운 재테크 방식에 관심이 생기는 날입니다. 공부부터 시작해보시기 바랍니다.,오전 10시~12시,쌍둥이자리는 오전 중반이 말이 잘 나오는 시간입니다. 이 시간대 연락이 가장 자연스럽게 이어집니다.
쌍둥이자리,금전운,오늘 금전 스트레스가 있다면 숫자로 정리해보시기 바랍니다. 보이면 해결책도 보여요.,오전 10시~12시,쌍둥이자리는 오전 중반이 말이 잘 나오는 시간입니다. 이 시간대 연락이 가장 자연스럽게 이어집니다.
쌍둥이자리,금전운,쌍둥이자리의 네트워크가 금전 기회로 이어지는 날입니다.,오전 10시~12시,쌍둥이자리는 오전 중반이 말이 잘 나오는 시간입니다. 이 시간대 연락이 가장 자연스럽게 이어집니다.
쌍둥이자리,금전운,오늘 작은 금액이라도 저축하는 습관을 시작하기 좋은 날입니다.,오전 10시~12시,쌍둥이자리는 오전 중반이 말이 잘 나오는 시간입니다. 이 시간대 연락이 가장 자연스럽게 이어집니다.
쌍둥이자리,금전운,비용 절감 아이디어가 떠오르는 날입니다. 쌍둥이자리의 창의성이 여기서도 써먹혀요.,오전 10시~12시,쌍둥이자리는 오전 중반이 말이 잘 나오는 시간입니다. 이 시간대 연락이 가장 자연스럽게 이어집니다.
쌍둥이자리,금전운,오늘 돈에 대한 생각을 정리하는 시간을 가져보시기 바랍니다. 가치관을 명확히 하는 것이 소비를 바꿔요.,오전 10시~12시,쌍둥이자리는 오전 중반이 말이 잘 나오는 시간입니다. 이 시간대 연락이 가장 자연스럽게 이어집니다.
쌍둥이자리,직장운,오늘 소통에서 능력이 빛나는 날입니다. 프레젠테이션이나 발표가 있다면 오늘 최고의 퍼포먼스를 낼 수 있습니다.,오전 10시~12시,쌍둥이자리는 오전 중반이 말이 잘 나오는 시간입니다. 이 시간대 연락이 가장 자연스럽게 이어집니다.
쌍둥이자리,직장운,멀티태스킹이 잘 되는 날입니다. 여러 업무를 동시에 처리해도 비교적 잘 돌아가는 흐름입니다.,오전 10시~12시,쌍둥이자리는 오전 중반이 말이 잘 나오는 시간입니다. 이 시간대 연락이 가장 자연스럽게 이어집니다.
쌍둥이자리,직장운,새로운 프로젝트나 아이디어 제안이 잘 받아들여지는 날입니다.,오전 10시~12시,쌍둥이자리는 오전 중반이 말이 잘 나오는 시간입니다. 이 시간대 연락이 가장 자연스럽게 이어집니다.
쌍둥이자리,직장운,집중이 흩어지는 날입니다. 중요한 업무를 먼저 끝내고 나머지를 처리하는 순서가 필요합니다.,오전 10시~12시,쌍둥이자리는 오전 중반이 말이 잘 나오는 시간입니다. 이 시간대 연락이 가장 자연스럽게 이어집니다.
쌍둥이자리,직장운,오늘 팀 내 소통에서 쌍둥이자리의 유연성이 빛나는 날입니다.,오전 10시~12시,쌍둥이자리는 오전 중반이 말이 잘 나오는 시간입니다. 이 시간대 연락이 가장 자연스럽게 이어집니다.
쌍둥이자리,직장운,업무 중 새로운 방식을 발견하는 날입니다. 기존 방식보다 훨씬 효율적인 것을 찾을 수 있습니다.,오전 10시~12시,쌍둥이자리는 오전 중반이 말이 잘 나오는 시간입니다. 이 시간대 연락이 가장 자연스럽게 이어집니다.
쌍둥이자리,직장운,오늘 말로 설득해야 하는 상황에서 쌍둥이자리가 가장 잘 합니다.,오전 10시~12시,쌍둥이자리는 오전 중반이 말이 잘 나오는 시간입니다. 이 시간대 연락이 가장 자연스럽게 이어집니다.
쌍둥이자리,직장운,여러 역할을 동시에 해야 하는 상황이 생길 수 있습니다. 쌍둥이자리는 이 상황에서 강합니다.,오전 10시~12시,쌍둥이자리는 오전 중반이 말이 잘 나오는 시간입니다. 이 시간대 연락이 가장 자연스럽게 이어집니다.
쌍둥이자리,직장운,오늘 창의적인 문제 해결이 필요한 과제가 주어질 수 있습니다. 쌍둥이자리의 아이디어로 풀어보시기 바랍니다.,오전 10시~12시,쌍둥이자리는 오전 중반이 말이 잘 나오는 시간입니다. 이 시간대 연락이 가장 자연스럽게 이어집니다.
쌍둥이자리,직장운,업무 마무리가 어려운 날입니다. 끝내는 것에 집중하는 날로 써보시기 바랍니다.,오전 10시~12시,쌍둥이자리는 오전 중반이 말이 잘 나오는 시간입니다. 이 시간대 연락이 가장 자연스럽게 이어집니다.
쌍둥이자리,직장운,오늘 네트워킹이나 새로운 연결이 업무에서 도움이 되는 날입니다.,오전 10시~12시,쌍둥이자리는 오전 중반이 말이 잘 나오는 시간입니다. 이 시간대 연락이 가장 자연스럽게 이어집니다.
쌍둥이자리,직장운,빠른 판단이 필요한 상황에서 쌍둥이자리의 능력이 발휘되는 날입니다.,오전 10시~12시,쌍둥이자리는 오전 중반이 말이 잘 나오는 시간입니다. 이 시간대 연락이 가장 자연스럽게 이어집니다.
쌍둥이자리,직장운,오늘 글쓰기나 기획 업무에서 특히 좋은 결과가 나오는 날입니다.,오전 10시~12시,쌍둥이자리는 오전 중반이 말이 잘 나오는 시간입니다. 이 시간대 연락이 가장 자연스럽게 이어집니다.
쌍둥이자리,직장운,주의가 산만해지기 쉬운 날입니다. 핸드폰이나 알림을 잠시 끄고 집중해보시기 바랍니다.,오전 10시~12시,쌍둥이자리는 오전 중반이 말이 잘 나오는 시간입니다. 이 시간대 연락이 가장 자연스럽게 이어집니다.
쌍둥이자리,직장운,오늘 동료와의 대화에서 중요한 업무 힌트를 얻을 수 있습니다.,오전 10시~12시,쌍둥이자리는 오전 중반이 말이 잘 나오는 시간입니다. 이 시간대 연락이 가장 자연스럽게 이어집니다.
쌍둥이자리,직장운,새로운 기술이나 도구를 배우기 좋은 날입니다. 쌍둥이자리는 학습 속도가 빠른 타입입니다.,오전 10시~12시,쌍둥이자리는 오전 중반이 말이 잘 나오는 시간입니다. 이 시간대 연락이 가장 자연스럽게 이어집니다.
쌍둥이자리,직장운,오늘 말 한마디로 분위기가 바뀌는 날입니다. 쌍둥이자리의 언어가 오늘 특히 영향력이 있습니다.,오전 10시~12시,쌍둥이자리는 오전 중반이 말이 잘 나오는 시간입니다. 이 시간대 연락이 가장 자연스럽게 이어집니다.
쌍둥이자리,직장운,여러 프로젝트 중 우선순위를 정하는 날입니다. 모두 다 하려다 아무것도 못 끝내는 패턴 주의합니다.,오전 10시~12시,쌍둥이자리는 오전 중반이 말이 잘 나오는 시간입니다. 이 시간대 연락이 가장 자연스럽게 이어집니다.
쌍둥이자리,직장운,오늘 창의성이 필요한 자리에서 쌍둥이자리가 빛나는 날입니다.,오전 10시~12시,쌍둥이자리는 오전 중반이 말이 잘 나오는 시간입니다. 이 시간대 연락이 가장 자연스럽게 이어집니다.
쌍둥이자리,직장운,마감 전 집중력이 올라오는 쌍둥이자리의 특성이 오늘 발휘되는 날입니다.,오전 10시~12시,쌍둥이자리는 오전 중반이 말이 잘 나오는 시간입니다. 이 시간대 연락이 가장 자연스럽게 이어집니다.
쌍둥이자리,건강운,머리를 너무 많이 쓰는 날입니다. 과호흡이나 두통이 생길 수 있으니 중간중간 눈 감고 쉬어보시기 바랍니다.,오전 10시~12시,쌍둥이자리는 오전 중반이 말이 잘 나오는 시간입니다. 이 시간대 연락이 가장 자연스럽게 이어집니다.
쌍둥이자리,건강운,오늘 몸보다 뇌가 먼저 지치는 날입니다. 자극적인 것들을 줄이고 조용한 시간을 가져보시기 바랍니다.,오전 10시~12시,쌍둥이자리는 오전 중반이 말이 잘 나오는 시간입니다. 이 시간대 연락이 가장 자연스럽게 이어집니다.
쌍둥이자리,건강운,규칙적인 식사가 오늘 특히 중요합니다. 쌍둥이자리는 바쁘면 끼니를 거르는 타입입니다.,오전 10시~12시,쌍둥이자리는 오전 중반이 말이 잘 나오는 시간입니다. 이 시간대 연락이 가장 자연스럽게 이어집니다.
쌍둥이자리,건강운,신선한 공기가 도움이 되는 날입니다. 짧게라도 밖에 나가보시기 바랍니다.,오전 10시~12시,쌍둥이자리는 오전 중반이 말이 잘 나오는 시간입니다. 이 시간대 연락이 가장 자연스럽게 이어집니다.
쌍둥이자리,건강운,오늘 수면 질을 높이는 것이 내일의 에너지를 만들습니다. 잠들기 전 디지털 기기를 멀리해보시기 바랍니다.,오전 10시~12시,쌍둥이자리는 오전 중반이 말이 잘 나오는 시간입니다. 이 시간대 연락이 가장 자연스럽게 이어집니다.
쌍둥이자리,건강운,"쌍둥이자리는 손을 쓰는 활동이 뇌를 쉬게 합니다. 글쓰기, 그림, 요리 같은 것을 해보시기 바랍니다.",오전 10시~12시,쌍둥이자리는 오전 중반이 말이 잘 나오는 시간입니다. 이 시간대 연락이 가장 자연스럽게 이어집니다.
쌍둥이자리,건강운,오늘 카페인을 줄이고 물을 더 마시는 날로 해보시기 바랍니다.,오전 10시~12시,쌍둥이자리는 오전 중반이 말이 잘 나오는 시간입니다. 이 시간대 연락이 가장 자연스럽게 이어집니다.
쌍둥이자리,건강운,가벼운 스트레칭으로 하루를 시작하면 오늘 하루 전체 흐름이 달라집니다.,오전 10시~12시,쌍둥이자리는 오전 중반이 말이 잘 나오는 시간입니다. 이 시간대 연락이 가장 자연스럽게 이어집니다.
쌍둥이자리,건강운,신경이 예민해지기 쉬운 날입니다. 오늘은 조용한 환경에서 일하거나 이어폰을 활용해보시기 바랍니다.,오전 10시~12시,쌍둥이자리는 오전 중반이 말이 잘 나오는 시간입니다. 이 시간대 연락이 가장 자연스럽게 이어집니다.
쌍둥이자리,건강운,오늘 몸이 피로 신호를 보내고 있습니다. 쌍둥이자리는 무시하는 타입인데 오늘은 들어주시기 바랍니다.,오전 10시~12시,쌍둥이자리는 오전 중반이 말이 잘 나오는 시간입니다. 이 시간대 연락이 가장 자연스럽게 이어집니다.
쌍둥이자리,건강운,새로운 운동을 시도하기 좋은 날입니다. 쌍둥이자리는 지루하지 않은 운동이 맞습니다.,오전 10시~12시,쌍둥이자리는 오전 중반이 말이 잘 나오는 시간입니다. 이 시간대 연락이 가장 자연스럽게 이어집니다.
쌍둥이자리,건강운,오늘 정보 과부하를 조심하시기 바랍니다. SNS나 뉴스에서 잠시 벗어나는 것이 뇌 건강에 좋습니다.,오전 10시~12시,쌍둥이자리는 오전 중반이 말이 잘 나오는 시간입니다. 이 시간대 연락이 가장 자연스럽게 이어집니다.
쌍둥이자리,건강운,손목이나 목 결림이 생기기 쉬운 날입니다. 자세 점검해보시기 바랍니다.,오전 10시~12시,쌍둥이자리는 오전 중반이 말이 잘 나오는 시간입니다. 이 시간대 연락이 가장 자연스럽게 이어집니다.
쌍둥이자리,건강운,오늘 에너지가 고르지 않습니다. 오전에 집중하고 오후에 여유를 두는 흐름이 맞습니다.,오전 10시~12시,쌍둥이자리는 오전 중반이 말이 잘 나오는 시간입니다. 이 시간대 연락이 가장 자연스럽게 이어집니다.
쌍둥이자리,건강운,몸보다 마음이 먼저 쉬고 싶은 날입니다. 생각을 비우는 시간을 잠깐 가져보시기 바랍니다.,오전 10시~12시,쌍둥이자리는 오전 중반이 말이 잘 나오는 시간입니다. 이 시간대 연락이 가장 자연스럽게 이어집니다.
쌍둥이자리,건강운,다양한 운동 루틴을 시도하는 것이 쌍둥이자리에게 잘 맞습니다. 오늘 새로운 것을 하나 해보시기 바랍니다.,오전 10시~12시,쌍둥이자리는 오전 중반이 말이 잘 나오는 시간입니다. 이 시간대 연락이 가장 자연스럽게 이어집니다.
쌍둥이자리,건강운,오늘 음식에서도 다양함을 즐기는 날입니다. 새로운 메뉴 시도해보시기 바랍니다.,오전 10시~12시,쌍둥이자리는 오전 중반이 말이 잘 나오는 시간입니다. 이 시간대 연락이 가장 자연스럽게 이어집니다.
쌍둥이자리,건강운,집중력이 흐트러질 때 잠깐 명상이나 호흡 연습이 도움이 되는 날입니다.,오전 10시~12시,쌍둥이자리는 오전 중반이 말이 잘 나오는 시간입니다. 이 시간대 연락이 가장 자연스럽게 이어집니다.
쌍둥이자리,건강운,오늘 수면이 부족하다면 낮에 짧은 휴식을 취해보시기 바랍니다.,오전 10시~12시,쌍둥이자리는 오전 중반이 말이 잘 나오는 시간입니다. 이 시간대 연락이 가장 자연스럽게 이어집니다.
쌍둥이자리,건강운,쌍둥이자리의 활발한 에너지를 신체 활동으로 건강하게 발산하는 날입니다.,오전 10시~12시,쌍둥이자리는 오전 중반이 말이 잘 나오는 시간입니다. 이 시간대 연락이 가장 자연스럽게 이어집니다.
쌍둥이자리,대인운,오늘 새로운 사람을 만나기 좋은 날입니다. 쌍둥이자리는 첫 대화에서 빛나는 타입입니다.,오전 10시~12시,쌍둥이자리는 오전 중반이 말이 잘 나오는 시간입니다. 이 시간대 연락이 가장 자연스럽게 이어집니다.
쌍둥이자리,대인운,다양한 사람들과 교류하고 싶은 날입니다. 그 에너지를 편하게 써도 되는 날입니다.,오전 10시~12시,쌍둥이자리는 오전 중반이 말이 잘 나오는 시간입니다. 이 시간대 연락이 가장 자연스럽게 이어집니다.
쌍둥이자리,대인운,오늘 주변 사람들이 쌍둥이자리의 말에 귀를 기울이는 날입니다.,오전 10시~12시,쌍둥이자리는 오전 중반이 말이 잘 나오는 시간입니다. 이 시간대 연락이 가장 자연스럽게 이어집니다.
쌍둥이자리,대인운,오래된 친구와 재미있는 대화를 나누기 좋은 날입니다.,오전 10시~12시,쌍둥이자리는 오전 중반이 말이 잘 나오는 시간입니다. 이 시간대 연락이 가장 자연스럽게 이어집니다.
쌍둥이자리,대인운,오늘 당신의 가벼운 유머가 주변 분위기를 밝게 만들습니다.,오전 10시~12시,쌍둥이자리는 오전 중반이 말이 잘 나오는 시간입니다. 이 시간대 연락이 가장 자연스럽게 이어집니다.
쌍둥이자리,대인운,말이 너무 많아지는 날입니다. 오늘은 상대방이 말할 공간을 더 줘보시기 바랍니다.,오전 10시~12시,쌍둥이자리는 오전 중반이 말이 잘 나오는 시간입니다. 이 시간대 연락이 가장 자연스럽게 이어집니다.
쌍둥이자리,대인운,새로운 모임이나 그룹에 합류하기 좋은 날입니다.,오전 10시~12시,쌍둥이자리는 오전 중반이 말이 잘 나오는 시간입니다. 이 시간대 연락이 가장 자연스럽게 이어집니다.
쌍둥이자리,대인운,오늘 쌍둥이자리의 적응력이 어떤 상황에서도 빛나는 날입니다.,오전 10시~12시,쌍둥이자리는 오전 중반이 말이 잘 나오는 시간입니다. 이 시간대 연락이 가장 자연스럽게 이어집니다.
쌍둥이자리,대인운,여러 사람 사이에서 다리 역할을 하게 되는 날입니다. 쌍둥이자리는 이 역할이 자연스러워요.,오전 10시~12시,쌍둥이자리는 오전 중반이 말이 잘 나오는 시간입니다. 이 시간대 연락이 가장 자연스럽게 이어집니다.
쌍둥이자리,대인운,오늘 누군가와 공통 관심사를 발견하는 날입니다. 그 연결이 의외로 깊어질 수 있습니다.,오전 10시~12시,쌍둥이자리는 오전 중반이 말이 잘 나오는 시간입니다. 이 시간대 연락이 가장 자연스럽게 이어집니다.
쌍둥이자리,대인운,정보를 나눠주는 것이 오늘 인간관계에서 좋은 역할을 합니다.,오전 10시~12시,쌍둥이자리는 오전 중반이 말이 잘 나오는 시간입니다. 이 시간대 연락이 가장 자연스럽게 이어집니다.
쌍둥이자리,대인운,오늘 솔직한 대화가 관계를 더 가깝게 만드는 날입니다.,오전 10시~12시,쌍둥이자리는 오전 중반이 말이 잘 나오는 시간입니다. 이 시간대 연락이 가장 자연스럽게 이어집니다.
쌍둥이자리,대인운,다양한 인연이 오가는 날입니다. 그 중에서 진짜 중요한 사람이 누군지 생각해보시기 바랍니다.,오전 10시~12시,쌍둥이자리는 오전 중반이 말이 잘 나오는 시간입니다. 이 시간대 연락이 가장 자연스럽게 이어집니다.
쌍둥이자리,대인운,오늘 쌍둥이자리의 재치와 유머로 어색한 자리가 편안해지는 날입니다.,오전 10시~12시,쌍둥이자리는 오전 중반이 말이 잘 나오는 시간입니다. 이 시간대 연락이 가장 자연스럽게 이어집니다.
쌍둥이자리,대인운,여러 관계를 동시에 관리하는 쌍둥이자리의 능력이 오늘 빛습니다.,오전 10시~12시,쌍둥이자리는 오전 중반이 말이 잘 나오는 시간입니다. 이 시간대 연락이 가장 자연스럽게 이어집니다.
쌍둥이자리,대인운,오늘 한 사람에게 집중하는 시간을 가져보시기 바랍니다. 쌍둥이자리는 깊은 연결도 할 수 있는 타입입니다.,오전 10시~12시,쌍둥이자리는 오전 중반이 말이 잘 나오는 시간입니다. 이 시간대 연락이 가장 자연스럽게 이어집니다.
쌍둥이자리,대인운,오늘 주변의 말 한마디가 오래 기억에 남을 수 있습니다.,오전 10시~12시,쌍둥이자리는 오전 중반이 말이 잘 나오는 시간입니다. 이 시간대 연락이 가장 자연스럽게 이어집니다.
쌍둥이자리,대인운,그룹에서 자연스럽게 이야기를 이끌어 가는 날입니다.,오전 10시~12시,쌍둥이자리는 오전 중반이 말이 잘 나오는 시간입니다. 이 시간대 연락이 가장 자연스럽게 이어집니다.
쌍둥이자리,대인운,오늘 기존 인간관계에서 새로운 면을 발견하는 날입니다.,오전 10시~12시,쌍둥이자리는 오전 중반이 말이 잘 나오는 시간입니다. 이 시간대 연락이 가장 자연스럽게 이어집니다.
쌍둥이자리,대인운,쌍둥이자리의 열린 태도가 오늘 좋은 인연을 불러오는 날입니다.,오전 10시~12시,쌍둥이자리는 오전 중반이 말이 잘 나오는 시간입니다. 이 시간대 연락이 가장 자연스럽게 이어집니다.
쌍둥이자리,행동운,오늘 먼저 생각하고 행동하는 날입니다. 쌍둥이자리는 말이 앞서는 타입인데 오늘은 행동이 먼저입니다.,오전 10시~12시,쌍둥이자리는 오전 중반이 말이 잘 나오는 시간입니다. 이 시간대 연락이 가장 자연스럽게 이어집니다.
쌍둥이자리,행동운,두 가지 중 하나를 골라야 할 때 오늘은 직감을 따라가봐도 좋습니다.,오전 10시~12시,쌍둥이자리는 오전 중반이 말이 잘 나오는 시간입니다. 이 시간대 연락이 가장 자연스럽게 이어집니다.
쌍둥이자리,행동운,오늘 새로운 것을 배우거나 시도하기 좋은 날입니다. 쌍둥이자리의 학습 속도가 오늘 특히 빨라요.,오전 10시~12시,쌍둥이자리는 오전 중반이 말이 잘 나오는 시간입니다. 이 시간대 연락이 가장 자연스럽게 이어집니다.
쌍둥이자리,행동운,미뤄뒀던 연락 하나를 오늘 해보시기 바랍니다. 쌍둥이자리는 대화에서 에너지를 얻는 타입입니다.,오전 10시~12시,쌍둥이자리는 오전 중반이 말이 잘 나오는 시간입니다. 이 시간대 연락이 가장 자연스럽게 이어집니다.
쌍둥이자리,행동운,오늘 아이디어를 메모하는 것만으로도 충분한 행동입니다.,오전 10시~12시,쌍둥이자리는 오전 중반이 말이 잘 나오는 시간입니다. 이 시간대 연락이 가장 자연스럽게 이어집니다.
쌍둥이자리,행동운,변화를 주는 행동 하나가 오늘 하루를 새롭게 만들습니다.,오전 10시~12시,쌍둥이자리는 오전 중반이 말이 잘 나오는 시간입니다. 이 시간대 연락이 가장 자연스럽게 이어집니다.
쌍둥이자리,행동운,오늘 계획 없이 움직여도 잘 되는 날입니다. 쌍둥이자리는 즉흥에서 빛나는 타입입니다.,오전 10시~12시,쌍둥이자리는 오전 중반이 말이 잘 나오는 시간입니다. 이 시간대 연락이 가장 자연스럽게 이어집니다.
쌍둥이자리,행동운,시작한 것을 오늘 끝까지 마무리하는 날로 써보시기 바랍니다.,오전 10시~12시,쌍둥이자리는 오전 중반이 말이 잘 나오는 시간입니다. 이 시간대 연락이 가장 자연스럽게 이어집니다.
