zodiac,type,fortune,contact_time,contact_reason
사수자리,건강운,오늘 여행이나 새로운 환경이 건강을 회복시키는 날입니다.,오후 2시~5시,사수자리는 오후에 에너지가 올라오는 타입입니다. 이 시간대 연락이 가장 활기차게 이어집니다.
사수자리,건강운,규칙적인 운동을 시작하기 좋은 날입니다.,오후 2시~5시,사수자리는 오후에 에너지가 올라오는 타입입니다. 이 시간대 연락이 가장 활기차게 이어집니다.
사수자리,건강운,오늘 스트레칭이 허리 건강을 지켜주는 날입니다.,오후 2시~5시,사수자리는 오후에 에너지가 올라오는 타입입니다. 이 시간대 연락이 가장 활기차게 이어집니다.
사수자리,건강운,낙관적인 에너지가 면역력에도 영향을 주는 날입니다.,오후 2시~5시,사수자리는 오후에 에너지가 올라오는 타입입니다. 이 시간대 연락이 가장 활기차게 이어집니다.
사수자리,건강운,오늘 자연 속에서 시간을 보내면 몸과 마음이 회복되는 날입니다.,오후 2시~5시,사수자리는 오후에 에너지가 올라오는 타입입니다. 이 시간대 연락이 가장 활기차게 이어집니다.
사수자리,건강운,음식의 다양성이 오늘 즐거움이 되는 날입니다.,오후 2시~5시,사수자리는 오후에 에너지가 올라오는 타입입니다. 이 시간대 연락이 가장 활기차게 이어집니다.
사수자리,건강운,오늘 과도한 목표보다 즐기면서 건강을 유지하는 날입니다.,오후 2시~5시,사수자리는 오후에 에너지가 올라오는 타입입니다. 이 시간대 연락이 가장 활기차게 이어집니다.
사수자리,건강운,신체적 자유를 느끼는 활동이 오늘 최고의 건강법입니다.,오후 2시~5시,사수자리는 오후에 에너지가 올라오는 타입입니다. 이 시간대 연락이 가장 활기차게 이어집니다.
사수자리,건강운,사수자리의 강한 회복력이 오늘도 발휘되는 날입니다.,오후 2시~5시,사수자리는 오후에 에너지가 올라오는 타입입니다. 이 시간대 연락이 가장 활기차게 이어집니다.
사수자리,대인운,오늘 다양한 사람들과 교류하는 에너지가 올라오는 날입니다.,오후 2시~5시,사수자리는 오후에 에너지가 올라오는 타입입니다. 이 시간대 연락이 가장 활기차게 이어집니다.
사수자리,대인운,새로운 사람과의 만남에서 모험이 시작되는 날입니다.,오후 2시~5시,사수자리는 오후에 에너지가 올라오는 타입입니다. 이 시간대 연락이 가장 활기차게 이어집니다.
사수자리,대인운,사수자리의 솔직함이 오늘 관계를 신선하게 만드는 날입니다.,오후 2시~5시,사수자리는 오후에 에너지가 올라오는 타입입니다. 이 시간대 연락이 가장 활기차게 이어집니다.
사수자리,대인운,오늘 다양한 배경의 사람들과 연결되는 날입니다.,오후 2시~5시,사수자리는 오후에 에너지가 올라오는 타입입니다. 이 시간대 연락이 가장 활기차게 이어집니다.
사수자리,대인운,자유롭고 열린 태도가 오늘 좋은 인연을 불러오는 날입니다.,오후 2시~5시,사수자리는 오후에 에너지가 올라오는 타입입니다. 이 시간대 연락이 가장 활기차게 이어집니다.
사수자리,대인운,오늘 먼 곳에 있는 사람과의 연결이 생기는 날입니다.,오후 2시~5시,사수자리는 오후에 에너지가 올라오는 타입입니다. 이 시간대 연락이 가장 활기차게 이어집니다.
사수자리,대인운,사수자리의 유머가 오늘 모임을 밝게 만드는 날입니다.,오후 2시~5시,사수자리는 오후에 에너지가 올라오는 타입입니다. 이 시간대 연락이 가장 활기차게 이어집니다.
사수자리,대인운,오늘 가르치거나 나누는 것에서 관계가 깊어지는 날입니다.,오후 2시~5시,사수자리는 오후에 에너지가 올라오는 타입입니다. 이 시간대 연락이 가장 활기차게 이어집니다.
사수자리,대인운,다양한 관점을 나누는 대화가 오늘 에너지가 되는 날입니다.,오후 2시~5시,사수자리는 오후에 에너지가 올라오는 타입입니다. 이 시간대 연락이 가장 활기차게 이어집니다.
사수자리,대인운,오늘 주변 사람들에게 영감을 주는 날입니다.,오후 2시~5시,사수자리는 오후에 에너지가 올라오는 타입입니다. 이 시간대 연락이 가장 활기차게 이어집니다.
사수자리,대인운,솔직하고 자유로운 소통이 오늘 관계를 풍요롭게 합니다.,오후 2시~5시,사수자리는 오후에 에너지가 올라오는 타입입니다. 이 시간대 연락이 가장 활기차게 이어집니다.
사수자리,대인운,오늘 새로운 모임이나 커뮤니티에 합류하기 좋은 날입니다.,오후 2시~5시,사수자리는 오후에 에너지가 올라오는 타입입니다. 이 시간대 연락이 가장 활기차게 이어집니다.
사수자리,대인운,사수자리의 낙관주의가 힘든 사람에게 희망이 되는 날입니다.,오후 2시~5시,사수자리는 오후에 에너지가 올라오는 타입입니다. 이 시간대 연락이 가장 활기차게 이어집니다.
사수자리,대인운,오늘 대화에서 중요한 인생의 통찰을 나누는 날입니다.,오후 2시~5시,사수자리는 오후에 에너지가 올라오는 타입입니다. 이 시간대 연락이 가장 활기차게 이어집니다.
사수자리,대인운,다양한 사람들과의 교류에서 새로운 아이디어를 얻는 날입니다.,오후 2시~5시,사수자리는 오후에 에너지가 올라오는 타입입니다. 이 시간대 연락이 가장 활기차게 이어집니다.
사수자리,대인운,오늘 자유로운 관계에서 더 깊은 연결이 생기는 날입니다.,오후 2시~5시,사수자리는 오후에 에너지가 올라오는 타입입니다. 이 시간대 연락이 가장 활기차게 이어집니다.
사수자리,대인운,사수자리의 철학적 대화가 오늘 누군가에게 도움이 되는 날입니다.,오후 2시~5시,사수자리는 오후에 에너지가 올라오는 타입입니다. 이 시간대 연락이 가장 활기차게 이어집니다.
사수자리,대인운,오늘 주변 사람들과 함께하는 모험이 즐거운 날입니다.,오후 2시~5시,사수자리는 오후에 에너지가 올라오는 타입입니다. 이 시간대 연락이 가장 활기차게 이어집니다.
사수자리,대인운,새로운 곳에서 새로운 사람을 만나는 것이 오늘 최고의 경험입니다.,오후 2시~5시,사수자리는 오후에 에너지가 올라오는 타입입니다. 이 시간대 연락이 가장 활기차게 이어집니다.
사수자리,대인운,오늘 사수자리의 열린 마음이 좋은 관계를 만드는 날입니다.,오후 2시~5시,사수자리는 오후에 에너지가 올라오는 타입입니다. 이 시간대 연락이 가장 활기차게 이어집니다.
사수자리,행동운,오늘 새로운 것을 시작하기 정확히 좋은 날입니다.,오후 2시~5시,사수자리는 오후에 에너지가 올라오는 타입입니다. 이 시간대 연락이 가장 활기차게 이어집니다.
사수자리,행동운,자유롭게 움직이는 행동이 오늘 가장 잘 맞습니다.,오후 2시~5시,사수자리는 오후에 에너지가 올라오는 타입입니다. 이 시간대 연락이 가장 활기차게 이어집니다.
사수자리,행동운,오늘 직관을 믿고 바로 행동하는 날입니다.,오후 2시~5시,사수자리는 오후에 에너지가 올라오는 타입입니다. 이 시간대 연락이 가장 활기차게 이어집니다.
사수자리,행동운,큰 목표를 향한 첫 걸음을 내딛는 날입니다.,오후 2시~5시,사수자리는 오후에 에너지가 올라오는 타입입니다. 이 시간대 연락이 가장 활기차게 이어집니다.
사수자리,행동운,오늘 모험적인 선택이 오히려 더 좋은 결과를 만들습니다.,오후 2시~5시,사수자리는 오후에 에너지가 올라오는 타입입니다. 이 시간대 연락이 가장 활기차게 이어집니다.
사수자리,행동운,계획 없이 움직여도 되는 날입니다. 사수자리는 즉흥에서 빛습니다.,오후 2시~5시,사수자리는 오후에 에너지가 올라오는 타입입니다. 이 시간대 연락이 가장 활기차게 이어집니다.
사수자리,행동운,오늘 배우는 행동 하나가 나중에 큰 자산이 되는 날입니다.,오후 2시~5시,사수자리는 오후에 에너지가 올라오는 타입입니다. 이 시간대 연락이 가장 활기차게 이어집니다.
사수자리,행동운,자유를 선택하는 용기 있는 행동이 오늘 맞습니다.,오후 2시~5시,사수자리는 오후에 에너지가 올라오는 타입입니다. 이 시간대 연락이 가장 활기차게 이어집니다.
사수자리,행동운,오늘 한계를 넘어서는 행동을 시도하는 날입니다.,오후 2시~5시,사수자리는 오후에 에너지가 올라오는 타입입니다. 이 시간대 연락이 가장 활기차게 이어집니다.
사수자리,행동운,낙관적인 마음으로 시작하는 행동이 오늘 성공을 만들습니다.,오후 2시~5시,사수자리는 오후에 에너지가 올라오는 타입입니다. 이 시간대 연락이 가장 활기차게 이어집니다.
사수자리,행동운,오늘 새로운 곳으로 이동하거나 탐험하는 행동이 에너지를 올립니다.,오후 2시~5시,사수자리는 오후에 에너지가 올라오는 타입입니다. 이 시간대 연락이 가장 활기차게 이어집니다.
사수자리,행동운,여행이나 새로운 경험을 계획하는 것이 오늘 즐거운 행동입니다.,오후 2시~5시,사수자리는 오후에 에너지가 올라오는 타입입니다. 이 시간대 연락이 가장 활기차게 이어집니다.
사수자리,행동운,오늘 큰 그림을 그리는 행동이 방향을 명확하게 합니다.,오후 2시~5시,사수자리는 오후에 에너지가 올라오는 타입입니다. 이 시간대 연락이 가장 활기차게 이어집니다.
사수자리,행동운,사수자리답게 당당하게 도전하는 행동이 오늘 빛나는 날입니다.,오후 2시~5시,사수자리는 오후에 에너지가 올라오는 타입입니다. 이 시간대 연락이 가장 활기차게 이어집니다.
사수자리,행동운,오늘 배움을 행동으로 연결하는 날입니다.,오후 2시~5시,사수자리는 오후에 에너지가 올라오는 타입입니다. 이 시간대 연락이 가장 활기차게 이어집니다.
사수자리,행동운,자유로운 발상을 실행으로 옮기는 것이 오늘 최고의 행동입니다.,오후 2시~5시,사수자리는 오후에 에너지가 올라오는 타입입니다. 이 시간대 연락이 가장 활기차게 이어집니다.
사수자리,행동운,오늘 규칙을 넘어서는 창의적인 행동이 인정받는 날입니다.,오후 2시~5시,사수자리는 오후에 에너지가 올라오는 타입입니다. 이 시간대 연락이 가장 활기차게 이어집니다.
사수자리,행동운,사수자리의 직관적인 행동이 오늘 정답이 되는 날입니다.,오후 2시~5시,사수자리는 오후에 에너지가 올라오는 타입입니다. 이 시간대 연락이 가장 활기차게 이어집니다.
사수자리,행동운,오늘 목표를 향해 과감하게 움직이는 날입니다.,오후 2시~5시,사수자리는 오후에 에너지가 올라오는 타입입니다. 이 시간대 연락이 가장 활기차게 이어집니다.
사수자리,행동운,새로운 모험의 첫 페이지를 오늘 쓰는 날입니다.,오후 2시~5시,사수자리는 오후에 에너지가 올라오는 타입입니다. 이 시간대 연락이 가장 활기차게 이어집니다.
염소자리,총운,오늘 목표를 향해 한 걸음씩 나아가는 날입니다. 염소자리는 결국 올라가는 타입입니다.,오전 8시~10시,염소자리는 이른 오전에 집중력이 최고입니다. 중요한 연락은 이 시간에 처리하는 게 가장 효과적입니다.
염소자리,총운,꾸준함이 오늘 결실을 맺는 날입니다.,오전 8시~10시,염소자리는 이른 오전에 집중력이 최고입니다. 중요한 연락은 이 시간에 처리하는 게 가장 효과적입니다.
염소자리,총운,일이 중심이 되는 날입니다. 그 에너지를 자신에게도 써보시기 바랍니다.,오전 8시~10시,염소자리는 이른 오전에 집중력이 최고입니다. 중요한 연락은 이 시간에 처리하는 게 가장 효과적입니다.
염소자리,총운,오늘 계획을 다시 점검하기 좋은 날입니다.,오전 8시~10시,염소자리는 이른 오전에 집중력이 최고입니다. 중요한 연락은 이 시간에 처리하는 게 가장 효과적입니다.
염소자리,총운,인내심이 가장 강한 무기인 날입니다.,오전 8시~10시,염소자리는 이른 오전에 집중력이 최고입니다. 중요한 연락은 이 시간에 처리하는 게 가장 효과적입니다.
염소자리,총운,오늘 결과가 드디어 보이기 시작하는 날입니다.,오전 8시~10시,염소자리는 이른 오전에 집중력이 최고입니다. 중요한 연락은 이 시간에 처리하는 게 가장 효과적입니다.
염소자리,총운,책임감이 오늘 주변에서 인정받는 날입니다.,오전 8시~10시,염소자리는 이른 오전에 집중력이 최고입니다. 중요한 연락은 이 시간에 처리하는 게 가장 효과적입니다.
염소자리,총운,오늘 쉬어가는 것도 목표의 일부입니다.,오전 8시~10시,염소자리는 이른 오전에 집중력이 최고입니다. 중요한 연락은 이 시간에 처리하는 게 가장 효과적입니다.
염소자리,총운,장기 목표를 향한 작은 진전이 오늘 의미 있는 날입니다.,오전 8시~10시,염소자리는 이른 오전에 집중력이 최고입니다. 중요한 연락은 이 시간에 처리하는 게 가장 효과적입니다.
염소자리,총운,염소자리의 실행력이 오늘 중요한 일을 해결하는 날입니다.,오전 8시~10시,염소자리는 이른 오전에 집중력이 최고입니다. 중요한 연락은 이 시간에 처리하는 게 가장 효과적입니다.
염소자리,총운,오늘 안정적인 흐름이 이어지는 날입니다.,오전 8시~10시,염소자리는 이른 오전에 집중력이 최고입니다. 중요한 연락은 이 시간에 처리하는 게 가장 효과적입니다.
염소자리,총운,성실함이 결과로 나타나는 날입니다.,오전 8시~10시,염소자리는 이른 오전에 집중력이 최고입니다. 중요한 연락은 이 시간에 처리하는 게 가장 효과적입니다.
염소자리,총운,오늘 혼자 집중하면 놀라운 결과가 나오는 날입니다.,오전 8시~10시,염소자리는 이른 오전에 집중력이 최고입니다. 중요한 연락은 이 시간에 처리하는 게 가장 효과적입니다.
염소자리,총운,목표를 위해 불필요한 것을 정리하는 날입니다.,오전 8시~10시,염소자리는 이른 오전에 집중력이 최고입니다. 중요한 연락은 이 시간에 처리하는 게 가장 효과적입니다.
염소자리,총운,오늘 염소자리의 인내가 드디어 빛을 발하는 날입니다.,오전 8시~10시,염소자리는 이른 오전에 집중력이 최고입니다. 중요한 연락은 이 시간에 처리하는 게 가장 효과적입니다.
염소자리,총운,야망이 현실로 이어지는 날입니다.,오전 8시~10시,염소자리는 이른 오전에 집중력이 최고입니다. 중요한 연락은 이 시간에 처리하는 게 가장 효과적입니다.
염소자리,총운,오늘 현실적인 계획이 가장 강한 도구입니다.,오전 8시~10시,염소자리는 이른 오전에 집중력이 최고입니다. 중요한 연락은 이 시간에 처리하는 게 가장 효과적입니다.
염소자리,총운,염소자리의 강인함이 어려운 상황을 이겨내게 하는 날입니다.,오전 8시~10시,염소자리는 이른 오전에 집중력이 최고입니다. 중요한 연락은 이 시간에 처리하는 게 가장 효과적입니다.
염소자리,총운,오늘 일과 삶의 균형을 점검하는 날입니다.,오전 8시~10시,염소자리는 이른 오전에 집중력이 최고입니다. 중요한 연락은 이 시간에 처리하는 게 가장 효과적입니다.
염소자리,총운,꾸준히 쌓아온 것들이 오늘 드디어 눈에 보이는 날입니다.,오전 8시~10시,염소자리는 이른 오전에 집중력이 최고입니다. 중요한 연락은 이 시간에 처리하는 게 가장 효과적입니다.
염소자리,애정운,오늘 천천히 신뢰를 쌓는 관계가 더 깊어지는 날입니다.,오전 8시~10시,염소자리는 이른 오전에 집중력이 최고입니다. 중요한 연락은 이 시간에 처리하는 게 가장 효과적입니다.
염소자리,애정운,감정 표현이 서툴더라도 오늘 한 번 시도해보시기 바랍니다.,오전 8시~10시,염소자리는 이른 오전에 집중력이 최고입니다. 중요한 연락은 이 시간에 처리하는 게 가장 효과적입니다.
염소자리,애정운,안정적인 관계가 오늘 특히 소중한 날입니다.,오전 8시~10시,염소자리는 이른 오전에 집중력이 최고입니다. 중요한 연락은 이 시간에 처리하는 게 가장 효과적입니다.
염소자리,애정운,파트너에게 현실적인 지원을 하는 것이 오늘 사랑입니다.,오전 8시~10시,염소자리는 이른 오전에 집중력이 최고입니다. 중요한 연락은 이 시간에 처리하는 게 가장 효과적입니다.
염소자리,애정운,오늘 관계에서 책임감이 매력으로 느껴지는 날입니다.,오전 8시~10시,염소자리는 이른 오전에 집중력이 최고입니다. 중요한 연락은 이 시간에 처리하는 게 가장 효과적입니다.
염소자리,애정운,말보다 행동으로 보여주는 것이 염소자리의 사랑입니다.,오전 8시~10시,염소자리는 이른 오전에 집중력이 최고입니다. 중요한 연락은 이 시간에 처리하는 게 가장 효과적입니다.
염소자리,애정운,오늘 오래된 관계가 더 단단해지는 날입니다.,오전 8시~10시,염소자리는 이른 오전에 집중력이 최고입니다. 중요한 연락은 이 시간에 처리하는 게 가장 효과적입니다.
염소자리,애정운,일에만 집중하다 관계를 놓치지 않도록 오늘 주의해보시기 바랍니다.,오전 8시~10시,염소자리는 이른 오전에 집중력이 최고입니다. 중요한 연락은 이 시간에 처리하는 게 가장 효과적입니다.
염소자리,애정운,오늘 파트너의 목표를 응원하는 것이 관계를 강하게 합니다.,오전 8시~10시,염소자리는 이른 오전에 집중력이 최고입니다. 중요한 연락은 이 시간에 처리하는 게 가장 효과적입니다.
염소자리,애정운,감정을 솔직하게 나누는 것이 오늘 관계의 열쇠입니다.,오전 8시~10시,염소자리는 이른 오전에 집중력이 최고입니다. 중요한 연락은 이 시간에 처리하는 게 가장 효과적입니다.
염소자리,애정운,오늘 안정감을 주는 관계가 에너지를 충전합니다.,오전 8시~10시,염소자리는 이른 오전에 집중력이 최고입니다. 중요한 연락은 이 시간에 처리하는 게 가장 효과적입니다.
염소자리,애정운,진지한 대화가 오늘 관계를 더 깊게 만드는 날입니다.,오전 8시~10시,염소자리는 이른 오전에 집중력이 최고입니다. 중요한 연락은 이 시간에 처리하는 게 가장 효과적입니다.
염소자리,애정운,오늘 작은 배려가 큰 사랑으로 전달되는 날입니다.,오전 8시~10시,염소자리는 이른 오전에 집중력이 최고입니다. 중요한 연락은 이 시간에 처리하는 게 가장 효과적입니다.
염소자리,애정운,신뢰가 오늘 관계의 기초가 되는 날입니다.,오전 8시~10시,염소자리는 이른 오전에 집중력이 최고입니다. 중요한 연락은 이 시간에 처리하는 게 가장 효과적입니다.
염소자리,애정운,오늘 관계에서 장기적인 계획을 함께 세우는 날입니다.,오전 8시~10시,염소자리는 이른 오전에 집중력이 최고입니다. 중요한 연락은 이 시간에 처리하는 게 가장 효과적입니다.
염소자리,애정운,염소자리의 든든함이 오늘 파트너에게 힘이 되는 날입니다.,오전 8시~10시,염소자리는 이른 오전에 집중력이 최고입니다. 중요한 연락은 이 시간에 처리하는 게 가장 효과적입니다.
염소자리,애정운,오늘 감정을 표현하는 것이 관계를 더 따뜻하게 합니다.,오전 8시~10시,염소자리는 이른 오전에 집중력이 최고입니다. 중요한 연락은 이 시간에 처리하는 게 가장 효과적입니다.
염소자리,애정운,관계에서 야망을 공유하는 것이 오늘 연결을 강하게 합니다.,오전 8시~10시,염소자리는 이른 오전에 집중력이 최고입니다. 중요한 연락은 이 시간에 처리하는 게 가장 효과적입니다.
염소자리,애정운,오늘 함께 목표를 향해 나아가는 것이 사랑입니다.,오전 8시~10시,염소자리는 이른 오전에 집중력이 최고입니다. 중요한 연락은 이 시간에 처리하는 게 가장 효과적입니다.
염소자리,애정운,염소자리의 성실함이 오늘 관계에서 빛나는 날입니다.,오전 8시~10시,염소자리는 이른 오전에 집중력이 최고입니다. 중요한 연락은 이 시간에 처리하는 게 가장 효과적입니다.
염소자리,금전운,오늘 장기 금전 계획을 세우기 좋은 날입니다.,오전 8시~10시,염소자리는 이른 오전에 집중력이 최고입니다. 중요한 연락은 이 시간에 처리하는 게 가장 효과적입니다.
염소자리,금전운,안전한 투자가 오늘 맞는 방향입니다.,오전 8시~10시,염소자리는 이른 오전에 집중력이 최고입니다. 중요한 연락은 이 시간에 처리하는 게 가장 효과적입니다.
염소자리,금전운,꾸준한 저축이 오늘 결실을 맺는 날입니다.,오전 8시~10시,염소자리는 이른 오전에 집중력이 최고입니다. 중요한 연락은 이 시간에 처리하는 게 가장 효과적입니다.
염소자리,금전운,금전 목표를 현실적으로 설정하는 날입니다.,오전 8시~10시,염소자리는 이른 오전에 집중력이 최고입니다. 중요한 연락은 이 시간에 처리하는 게 가장 효과적입니다.
염소자리,금전운,오늘 수입을 늘리는 구체적인 계획이 나오는 날입니다.,오전 8시~10시,염소자리는 이른 오전에 집중력이 최고입니다. 중요한 연락은 이 시간에 처리하는 게 가장 효과적입니다.
염소자리,금전운,계획적인 소비가 오늘 만족감을 주는 날입니다.,오전 8시~10시,염소자리는 이른 오전에 집중력이 최고입니다. 중요한 연락은 이 시간에 처리하는 게 가장 효과적입니다.
염소자리,금전운,오늘 금전 흐름을 꼼꼼하게 점검하는 날입니다.,오전 8시~10시,염소자리는 이른 오전에 집중력이 최고입니다. 중요한 연락은 이 시간에 처리하는 게 가장 효과적입니다.
염소자리,금전운,장기 투자가 오늘 특히 빛나는 선택입니다.,오전 8시~10시,염소자리는 이른 오전에 집중력이 최고입니다. 중요한 연락은 이 시간에 처리하는 게 가장 효과적입니다.
염소자리,금전운,안정적인 금전 흐름이 이어지는 날입니다.,오전 8시~10시,염소자리는 이른 오전에 집중력이 최고입니다. 중요한 연락은 이 시간에 처리하는 게 가장 효과적입니다.
염소자리,금전운,오늘 금전 관련 계약이나 서류를 확인하기 좋은 날입니다.,오전 8시~10시,염소자리는 이른 오전에 집중력이 최고입니다. 중요한 연락은 이 시간에 처리하는 게 가장 효과적입니다.
염소자리,금전운,염소자리의 인내가 금전에서도 결실로 이어지는 날입니다.,오전 8시~10시,염소자리는 이른 오전에 집중력이 최고입니다. 중요한 연락은 이 시간에 처리하는 게 가장 효과적입니다.
염소자리,금전운,오늘 작은 금전 목표를 달성하는 날입니다.,오전 8시~10시,염소자리는 이른 오전에 집중력이 최고입니다. 중요한 연락은 이 시간에 처리하는 게 가장 효과적입니다.
염소자리,금전운,현실적인 금전 계획이 가장 강한 도구인 날입니다.,오전 8시~10시,염소자리는 이른 오전에 집중력이 최고입니다. 중요한 연락은 이 시간에 처리하는 게 가장 효과적입니다.
염소자리,금전운,오늘 금전 스트레스를 줄이는 행동 하나를 해보시기 바랍니다.,오전 8시~10시,염소자리는 이른 오전에 집중력이 최고입니다. 중요한 연락은 이 시간에 처리하는 게 가장 효과적입니다.
염소자리,금전운,꾸준한 노력이 금전적 안정으로 이어지는 날입니다.,오전 8시~10시,염소자리는 이른 오전에 집중력이 최고입니다. 중요한 연락은 이 시간에 처리하는 게 가장 효과적입니다.
